{"say":"Describe a situation where you had to give difficult feedback to a teammate and how you approached it.","question":{"id":"q3","text":"Describe a situation where you had to give difficult feedback to a teammate and how you approached it.","competency":"situational","difficulty":2,"follow_ups":["How did they respond?"],"keyterms":["feedback","teammate","situation"]},"score":{"question_id":"q2","turn_order":1,"axes":{"structure":3,"specificity":3,"clarity":5,"relevance":5},"overall":4,"rationale":"Strongest in clarity, weakest in structure — focus on structure next.","evidence":[{"kind":"pause","text":"on write for critical entities. I would handle cache stampede","start_ms":143800,"end_ms":145500,"label":"02:23","note":"paused 1.7s here"},{"kind":"quote","text":"For a high traffic API serving millions of requests per day I would design a two tier caching layer with Redis for hot keys and CDN edge cache for static responses.","start_ms":125000,"end_ms":172000,"label":"02:05","note":"said: \"For a high traffic API serving millions of requests per day I would design a two tier caching layer with Redis for hot keys and CDN edge cache for static responses.\""},{"kind":"quote","text":"For","start_ms":125000,"end_ms":125250,"label":"02:05","note":"low confidence \"For\" here"}],"source":"deterministic"},"done":false,"degraded":false}