{"say":"Walk me through optimizing a slow database query that is causing timeouts in production.","question":{"id":"q4","text":"Walk me through optimizing a slow database query that is causing timeouts in production.","competency":"technical","difficulty":3,"follow_ups":["Can you elaborate on that answer?","What indexing strategy would you choose?"],"keyterms":["database","query","index","optimization"]},"score":{"question_id":"q3","turn_order":2,"axes":{"structure":3,"specificity":3,"clarity":4,"relevance":4},"overall":3.5,"rationale":"Strongest in clarity, weakest in structure — focus on structure next.","evidence":[{"kind":"filler","text":"kind of","start_ms":462000,"end_ms":462600,"label":"07:42","note":"said \"kind of\" 3x here"},{"kind":"quote","text":"During the last quarter I struggled to give feedback to a junior teammate who missed two deadlines recently It was kind of kind of kind of my fault to address directly.","start_ms":455000,"end_ms":492000,"label":"07:35","note":"said: \"During the last quarter I struggled to give feedback to a junior teammate who missed two deadlines recently It was kind of kind of kind of my fault to address directly.\""},{"kind":"quote","text":"During","start_ms":455000,"end_ms":455250,"label":"07:35","note":"low confidence \"During\" here"}],"source":"deterministic"},"done":false,"degraded":false}