{"say":"How did they respond?","question":{"id":"q3","text":"Describe a situation where you had to give difficult feedback to a teammate and how you approached it.","competency":"situational","difficulty":2,"follow_ups":["How did they respond?"],"keyterms":["feedback","teammate","situation"]},"score":{"question_id":"q4","turn_order":3,"axes":{"structure":4,"specificity":4,"clarity":5,"relevance":4},"overall":4.3,"rationale":"Strongest in clarity, weakest in structure — focus on structure next.","evidence":[{"kind":"quote","text":"Our orders search query was timing out after thirty seconds during peak traffic and affecting checkout conversion by eight percent.","start_ms":530000,"end_ms":573650,"label":"08:50","note":"said: \"Our orders search query was timing out after thirty seconds during peak traffic and affecting checkout conversion by eight percent.\""},{"kind":"quote","text":"Our","start_ms":530000,"end_ms":530250,"label":"08:50","note":"low confidence \"Our\" here"}],"source":"deterministic"},"done":false,"degraded":false}