{"say":"Explain how you would design a caching layer for a high-traffic API and handle cache invalidation.","question":{"id":"q2","text":"Explain how you would design a caching layer for a high-traffic API and handle cache invalidation.","competency":"technical","difficulty":2,"follow_ups":["How do you handle cache stampede?"],"keyterms":["caching","cache invalidation","API"]},"score":{"question_id":"q1","turn_order":0,"axes":{"structure":5,"specificity":4,"clarity":5,"relevance":4},"overall":4.5,"rationale":"Strongest in structure, weakest in specificity — focus on specificity next.","evidence":[{"kind":"quote","text":"When our production checkout service started returning 500 errors on Black Friday I was on call at two in the morning.","start_ms":5000,"end_ms":50050,"label":"00:05","note":"said: \"When our production checkout service started returning 500 errors on Black Friday I was on call at two in the morning.\""},{"kind":"quote","text":"When","start_ms":5000,"end_ms":5250,"label":"00:05","note":"low confidence \"When\" here"}],"source":"deterministic"},"done":false,"degraded":false}